{
  "nodeMergeRadius": 25,
  "maxSlope": 0.1,
  "castleHalfMin": 1000,
  "castleHalfMax": 4000,
  "civicSquareHalfSize": 30,
  "preferredBlockWidth": 80,
  "approachMargin": 100,
  "turnPenalty": 180,
  "mainStreetSpeed": 50,
  "collectorSpeed": 40,
  "localSpeed": 25,
  "minimumDryHeight": 0.5,
  "maximumBlockWidth": 190,
  "minimumBlockWidth": 64,
  "merchantWidthRatio": 0.91,
  "merchantDepthRatio": 0.96,
  "housingWidthRatio": 1.06,
  "housingDepthRatio": 1.1,
  "castleExtentRatio": 0.6,
  "gridPruneMinimum": 0.05,
  "gridPruneMaximum": 0.15,
  "crankMinimumLength": 40,
  "crankFirstSplit": 0.35,
  "crankSecondMinimumLength": 20,
  "crankSecondSplit": 0.55,
  "crankOffsetMinimum": 25,
  "crankOffsetMaximum": 40,
  "minimumKaidoAlignment": 0.3,
  "minimumTerrainHeight": 0.5,
  "terrainSampleStep": 16,
  "townFreeboard": 3.2,
  "buildableSampleInset": 12,
  "buildableSampleStep": 24,
  "townShrinkRatio": 0.85,
  "minimumTownHalfExtent": 85,
  "ruralRoadSearchMargin": 220,
  "ruralAnchorRatio": 0.3,
  "ruralAnchorSearchRadius": 180,
  "dispersedBranchLength": 175,
  "clusterBranchLength": 105,
  "valleyBranchLength": 70,
  "minimumRuralBranchLength": 45,
  "ruralPlanMargin": 48,
  "ringToleranceMinimum": 150,
  "ringToleranceRatio": 0.15,
  "minimumConnectorHeight": 0.5,
  "maximumConnectorSlope": 0.14,
  "mainArterialTownSize": 650,
  "stationWalkwayWidth": 3,
  "gatewayCornerSetback": 45,
  "gatewayMaximumHandle": 60,
  "alleyMinimumBlockLength": 88,
  "alleyMinimumBlockDepth": 44,
  "alleyLaneWidth": 2.2,
  "alleyShoulderWidth": 0.15
}
